<?xml version="1.0" encoding="UTF-8" ?>
<preset xmlns:xsi="http://www.w3.org/2001/XMLSchema-instance" xsi:noNamespaceSchemaLocation="preset.xsd">
	<font name="fontHud"><![CDATA[ !"#$%&'()*+,-./0123456789:;<=>?@ABCDEFGHIJKLMNOPQRSTUVWXYZ[\]^_`abcdefghijklmnopqrstuvwxyz{|}~ € ‚ƒ„…†‡ˆ‰Š‹Œ Ž  ‘’“”•–—˜™š›œ žŸ ¡¢£¤¥¦§¨©ª«¬­®¯°±²³´µ¶·¸¹º»¼½¾¿ÀÁÂÃÄÅÆÇÈÉÊËÌÍÎÏÐÑÒÓÔÕÖ×ØÙÚÛÜÝÞßàáâãäåæçèéêëìíîïðñòóôõö÷øùúûüýþÿЂЃ‚ѓ„…†‡€‰Љ‹ЊЌЋЏђ‘’“”•–— ™љ›њќћџ ЎўЈ¤Ґ¦§Ё©Є«¬­®Ї°±Ііґµ¶·ё№є»јЅѕїАБВГДЕЖЗИЙКЛМНОПРСТУФХЦЧШЩЪЫЬЭЮЯабвгдежзийклмнопрстуфхцчшщъыьэюя]]></font>
	<font name="fontHudMin"><![CDATA[ !"#$%&'()*+,-./0123456789:;<=>?@ABCDEFGHIJKLMNOPQRSTUVWXYZ[\]^_`abcdefghijklmnopqrstuvwxyz{|}~ € ‚ƒ„…†‡ˆ‰Š‹Œ Ž  ‘’“”•–—˜™š›œ žŸ ¡¢£¤¥¦§¨©ª«¬­®¯°±²³´µ¶·¸¹º»¼½¾¿ÀÁÂÃÄÅÆÇÈÉÊËÌÍÎÏÐÑÒÓÔÕÖ×ØÙÚÛÜÝÞßàáâãäåæçèéêëìíîïðñòóôõö÷øùúûüýþÿЂЃ‚ѓ„…†‡€‰Љ‹ЊЌЋЏђ‘’“”•–— ™љ›њќћџ ЎўЈ¤Ґ¦§Ё©Є«¬­®Ї°±Ііґµ¶·ё№є»јЅѕїАБВГДЕЖЗИЙКЛМНОПРСТУФХЦЧШЩЪЫЬЭЮЯабвгдежзийклмнопрстуфхцчшщъыьэюя]]></font>
	<font name="fontLives"><![CDATA[ !"#$%&'()*+,-./0123456789:;<=>?@ABCDEFGHIJKLMNOPQRSTUVWXYZ[\]^_`abcdefghijklmnopqrstuvwxyz{|}~ € ‚ƒ„…†‡ˆ‰Š‹Œ Ž  ‘’“”•–—˜™š›œ žŸ ¡¢£¤¥¦§¨©ª«¬­®¯°±²³´µ¶·¸¹º»¼½¾¿ÀÁÂÃÄÅÆÇÈÉÊËÌÍÎÏÐÑÒÓÔÕÖ×ØÙÚÛÜÝÞßàáâãäåæçèéêëìíîïðñòóôõö÷øùúûüýþÿЂЃ‚ѓ„…†‡€‰Љ‹ЊЌЋЏђ‘’“”•–— ™љ›њќћџ ЎўЈ¤Ґ¦§Ё©Є«¬­®Ї°±Ііґµ¶·ё№є»јЅѕїАБВГДЕЖЗИЙКЛМНОПРСТУФХЦЧШЩЪЫЬЭЮЯабвгдежзийклмнопрстуфхцчшщъыьэюя]]></font>
	<font name="fontMicro"><![CDATA[ !"#$%&'()*+,-./0123456789:;<=>?@ABCDEFGHIJKLMNOPQRSTUVWXYZ[\]^_`abcdefghijklmnopqrstuvwxyz{|}~ € ‚ƒ„…†‡ˆ‰Š‹Œ Ž  ‘’“”•–—˜™š›œ žŸ ¡¢£¤¥¦§¨©ª«¬­®¯°±²³´µ¶·¸¹º»¼½¾¿ÀÁÂÃÄÅÆÇÈÉÊËÌÍÎÏÐÑÒÓÔÕÖ×ØÙÚÛÜÝÞßàáâãäåæçèéêëìíîïðñòóôõö÷øùúûüýþÿЂЃ‚ѓ„…†‡€‰Љ‹ЊЌЋЏђ‘’“”•–— ™љ›њќћџ ЎўЈ¤Ґ¦§Ё©Є«¬­®Ї°±Ііґµ¶·ё№є»јЅѕїАБВГДЕЖЗИЙКЛМНОПРСТУФХЦЧШЩЪЫЬЭЮЯабвгдежзийклмнопрстуфхцчшщъыьэюя]]></font>
	<font name="fontMicroBackup"><![CDATA[ !"#$%&'()*+,-./0123456789:;<=>?@ABCDEFGHIJKLMNOPQRSTUVWXYZ[\]^_`abcdefghijklmnopqrstuvwxyz{|}~ € ‚ƒ„…†‡ˆ‰Š‹Œ Ž  ‘’“”•–—˜™š›œ žŸ ¡¢£¤¥¦§¨©ª«¬­®¯°±²³´µ¶·¸¹º»¼½¾¿ÀÁÂÃÄÅÆÇÈÉÊËÌÍÎÏÐÑÒÓÔÕÖ×ØÙÚÛÜÝÞßàáâãäåæçèéêëìíîïðñòóôõö÷øùúûüýþÿЂЃ‚ѓ„…†‡€‰Љ‹ЊЌЋЏђ‘’“”•–— ™љ›њќћџ ЎўЈ¤Ґ¦§Ё©Є«¬­®Ї°±Ііґµ¶·ё№є»јЅѕїАБВГДЕЖЗИЙКЛМНОПРСТУФХЦЧШЩЪЫЬЭЮЯабвгдежзийклмнопрстуфхцчшщъыьэюя]]></font>
	<font name="fontTitleLarge"><![CDATA[ !"#$%&'()*+,-./0123456789:;<=>?@ABCDEFGHIJKLMNOPQRSTUVWXYZ[\]^_`abcdefghijklmnopqrstuvwxyz{|}~ € ‚ƒ„…†‡ˆ‰Š‹Œ Ž  ‘’“”•–—˜™š›œ žŸ ¡¢£¤¥¦§¨©ª«¬­®¯°±²³´µ¶·¸¹º»¼½¾¿ÀÁÂÃÄÅÆÇÈÉÊËÌÍÎÏÐÑÒÓÔÕÖ×ØÙÚÛÜÝÞßàáâãäåæçèéêëìíîïðñòóôõö÷øùúûüýþÿЂЃ‚ѓ„…†‡€‰Љ‹ЊЌЋЏђ‘’“”•–— ™љ›њќћџ ЎўЈ¤Ґ¦§Ё©Є«¬­®Ї°±Ііґµ¶·ё№є»јЅѕїАБВГДЕЖЗИЙКЛМНОПРСТУФХЦЧШЩЪЫЬЭЮЯабвгдежзийклмнопрстуфхцчшщъыьэюя]]></font>
	<font name="fontTitleSmall"><![CDATA[ !"#$%&'()*+,-./0123456789:;<=>?@ABCDEFGHIJKLMNOPQRSTUVWXYZ[\]^_`abcdefghijklmnopqrstuvwxyz{|}~ € ‚ƒ„…†‡ˆ‰Š‹Œ Ž  ‘’“”•–—˜™š›œ žŸ ¡¢£¤¥¦§¨©ª«¬­®¯°±²³´µ¶·¸¹º»¼½¾¿ÀÁÂÃÄÅÆÇÈÉÊËÌÍÎÏÐÑÒÓÔÕÖ×ØÙÚÛÜÝÞßàáâãäåæçèéêëìíîïðñòóôõö÷øùúûüýþÿЂЃ‚ѓ„…†‡€‰Љ‹ЊЌЋЏђ‘’“”•–— ™љ›њќћџ ЎўЈ¤Ґ¦§Ё©Є«¬­®Ї°±Ііґµ¶·ё№є»јЅѕїАБВГДЕЖЗИЙКЛМНОПРСТУФХЦЧШЩЪЫЬЭЮЯабвгдежзийклмнопрстуфхцчшщъыьэюя]]></font>
	<font name="fontTitleSmallest"><![CDATA[ !"#$%&'()*+,-./0123456789:;<=>?@ABCDEFGHIJKLMNOPQRSTUVWXYZ[\]^_`abcdefghijklmnopqrstuvwxyz{|}~ € ‚ƒ„…†‡ˆ‰Š‹Œ Ž  ‘’“”•–—˜™š›œ žŸ ¡¢£¤¥¦§¨©ª«¬­®¯°±²³´µ¶·¸¹º»¼½¾¿ÀÁÂÃÄÅÆÇÈÉÊËÌÍÎÏÐÑÒÓÔÕÖ×ØÙÚÛÜÝÞßàáâãäåæçèéêëìíîïðñòóôõö÷øùúûüýþÿЂЃ‚ѓ„…†‡€‰Љ‹ЊЌЋЏђ‘’“”•–— ™љ›њќћџ ЎўЈ¤Ґ¦§Ё©Є«¬­®Ї°±Ііґµ¶·ё№є»јЅѕїАБВГДЕЖЗИЙКЛМНОПРСТУФХЦЧШЩЪЫЬЭЮЯабвгдежзийклмнопрстуфхцчшщъыьэюя]]></font>
</preset>